"","artist","song","text","Carolina","Laura"
"191","Neil Young","Everybody I Love You","Know you got to run,  
Know you got to hide  
Still there is a great life  
Lingerin' deep within your eyes.  
  
Open up, open up, baby let me in.  
  
You expect for me to love you  
When you hate yourself, my friend.  
  
Everybody, I love you  
Everybody, I do  
  
Though your heart is in anger  
I need your love to get through  
When I tell you I love you  
You can believe that it's true  
  
Everybody, I love you  
Everybody, I do.

",FALSE,FALSE
"192","Neil Young","Heart Of Gold","I want to live,  
I want to give  
I've been a miner  
for a heart of gold  
It's these expressions  
I never give  
That keep me searching  
for a heart of gold  
And I'm getting old  
Keeps me searching  
for a heart of gold  
And I'm getting old  
  
I've been to Hollywood  
I've been to Redwood  
I crossed the ocean  
for a heart of gold  
I've been in my mind,  
it's such a fine line  
That keeps me searching  
for a heart of gold  
And I'm getting old  
Keeps me searching  
for a heart of gold  
And I'm getting old  
  
Keep me searching  
for a heart of gold  
You keep me searching  
And I'm growing old  
Keep me searching  
for a heart of gold  
I've been a miner  
for a heart of gold

",FALSE,TRUE
"193","Nick Cave","I'm Gonna Kill That Woman","(J. L. Hooker)  
  
Yeah, my baby left me this morning  
And I don't care now, I don't care what the people say  
  
Yeah, I did everything that I could, everything I could,  
Lord knows I did everything I could  
I tried to satisfy her worried mind, that's what I did  
  
You know she was nothing but trouble, trouble  
She keep me worried all the time  
God knows her movements are killing me  
  
Yeah, my baby stayed out all night long, all night long  
She keep me worried all the time  
  
Yeah, I lay down last night I was thinking  
Must I kill that woman? Must I kill that woman?  
Oh Lord I get down on my knees  
They tell me God forgivin' everything you do  
But I don't care what the people say  
I'm gonna kill that woman,  
I'm gonna kill that woman, God knows  
I'm gonna get down on my knees

",FALSE,FALSE
"194","Nick Drake","Things Behind The Sun","Please beware of them that stare  
They'll only smile to see you while  
Your time away  
And once you've seen what they have been  
To win the earth just won't seem worth  
Your night or your day  
Who'll hear what I say.  
Look around you find the ground  
Is not so far from where you are  
But not too wise  
For down below they never grow  
They're always tired and charms are hired  
From out of their eyes  
Never surprise.  
  
Take your time and you'll be fine  
And say a prayer for people there  
Who live on the floor  
And if you see what's meant to be  
Don't name the day or try to say  
It happened before.  
  
Don't be shy you learn to fly  
And see the sun when day is done  
If only you see  
Just what you are beneath a star  
That came to stay one rainy day  
In autumn for free  
Yes, be what you'll be.  
Please beware of them that stare  
They'll only smile to see you while  
Your time away  
And once you've seen what they have been  
To win the earth just won't seem worth  
Your night or your day  
Who'll hear what I say.  
  
Open up the broken cup  
Let goodly sin and sunshine in  
Yes that's today.  
And open wide the hymns you hide  
You find renown while people frown  
At things that you say  
But say what you'll say  
About the farmers and the fun  
And the things behind the sun  
And the people around your head  
Who say everything's been said  
And the movement in your brain  
Sends you out into the rain.

",FALSE,FALSE
"195","Nickelback","Saturday Night's Alright","It's getting late I haven't seen my date  
So tell me when the boys get here  
It's seven o'clock and I want to rock  
Want to get a belly full of beer  
  
My old man's drunker than a barrel full of Winos  
And my old lady she don't care  
My sister's looking cute in her braces and boots  
A handful of grease in her hair  
  
Don't give us none of your aggravation  
We had it with your discipline  
Saturday night's alright for fighting  
Get a little action in  
  
Get about as oiled as a diesel train  
Gonna set this town alight  
Saturday night's the night I like  
Saturday night's alright alright alright  
  
They're packed pretty tight in here tonight  
I'm looking for a woman to treat me right  
I could use a little muscle to get what I need  
I'll drink a fifth of jack and scream out ""She's with me!""  
  
A couple of the sound that I really like  
Are the sounds of a switchblade and a motorbike  
I'm a juvenile product of the working class  
Whose best friend floats from the bottom of a glass

",FALSE,FALSE
"196","Nitty Gritty Dirt Band","Old Time's Sake","If this is our last dance  
Let's take it slow-owly  
Let's let our hearts break  
Just for old time's sake  
For old time's sake  
  
I don't want to be the one  
To say the night is over  
I don't want to be the one  
To say goodbye  
Let's face the music  
There's no turning back  
Just take my hand  
  
If this is our la-a-a-ast dance  
Let's take it slow-owly  
Let's let our hearts break  
Just for old time's sake  
For old time's sake  
  
Baby let me waltz away  
The memories of hard times  
Let me wipe away  
The tears from your eyes  
Can we be tender  
Just one more time  
We have tonight  
  
If this is our la-a-a-ast dance  
Let's take it slow-owly  
Let's let our hearts break  
Just for old time's sake  
For old time's sake  
  
For old time's sake (For old time's sake)  
Let me walk you home to your door  
For old time's sake (For old time's sake)  
Let's have one more night together  
For old time's sake (For old time's sake)  
Let me waltz you around across the floor  
For old time's sake (For old time's sake)

",FALSE,FALSE
"197","Nitty Gritty Dirt Band","Rave On","Well the little things that you say and do  
Make me want to be with you  
Oh, rave on it's a crazy feeling  
And I know it's got me reelin'  
  
When you say I love you  
Rave on  
The way you dance and hold me tight  
The way you kiss when we goodnight  
  
Rave on its a crazy feeling  
And I know its got me reelin'  
When you say I love you  
Oh, Rave on  
  
Well rave on its a crazy feeling  
And I know its got me reelin'  
I'm so glad your revealing your love for me  
Rave on, Rave on, tell me,  
  
Tell me not to be lonely,  
Tell me, you love me only  
Rave on to me

",FALSE,FALSE
"198","Oasis","My Big Mouth","Everybody knows...but no one's saying nothing  
  
And it's a sound so very loud...that no one can hear?  
  
I got something in my shoes...It's keeping me from walking  
  
Down the long and winding road...back home to you  
  
And round this town you've ceased to be  
  
That's what you got for sleeping with the enemy  
  
Where angels fly you won't play  
  
So guess who's gonna take the blame for...  
  
My Big Mouth my big name  
  
Who'll put on my shoes while they're walking  
  
Slowly down the hall of fame?  
  
Into my big mouth, you can fly a plane  
  
Who'll put on my shoes while they're walking  
  
Slowly down the hall of fame?  
  
Slowly down the hall of fame?  
  
I ain't never spoke to God  
  
And I ain't never been to heaven  
  
But you assumed I knew the way  
  
Even though the map was given  
  
And as you look into the eyes  
  
Of a bloody cold assassin  
  
Only then you realise  
  
With who's life you have been messin'

",FALSE,FALSE
"199","Ocean Colour Scene","I Am The News","I am the news and I'll say no more  
I am the stranger at your door  
I am the the deep beneath the sea  
The threat of flood tide rising  
I am the banks bearing refugees  
Always a cause not solution  
A constant fear or a fleeting joy  
Your only friend who needs using  
  
I am the news and I'm in your face  
And I'll take my profit from your faith  
I am the the face beneath the face  
The catalyst of explosions  
I am the crop bearing crippled genes  
I am an inside connection  
A constant friend on a changing screen  
Your history and direction  
  
Radio, radio  
I'll turn you on again  
You're the truth  
You're a soothe  
Be the blues  
Be my best friend  
Don't give us the truth  
I need the news again  
  
I am the news and I'm every spin  
I am what is and what's not in  
I am the trump card, I'm the ace  
I am the news and I'm in your face  
I am the ocean's biggest roar  
I am the smallest twist of fate  
I am the ending of a play  
I am the opening curtain  
  
I am the crop bearing crippled genes  
I am an inside connection  
A constant friend on a changing screen  
Your history and direction

",FALSE,FALSE
"200","Olivia Newton-John","Precious Love","In this world where life keeps changin'  
Nothin' ever seems to be enough  
I kept on, my soul was searchin'  
Lookin' for something that would fill me up  
I have always felt a yearnin'  
Somethin' inside me was unsatisfied  
  
Precious love you woke my heart up  
It's been sleepin' for such a long time  
This crazy feelin' I can believe in  
Your love has found it's way into my life  
  
Take our time, slow and easy  
I'm so comfortable when I'm with you  
Catch my breath when you come near me  
Can't control this if I wanted to  
Thought I'd never trust another  
But here, in your arms, I feel safe again  
  
Precious love you woke my heart up  
It's been sleepin' for such a long time  
This crazy feelin' I must be dreamin'  
Your love has found it's way into my life  
  
You touched a part of me  
And set my spirit free  
Precious love  
  
This crazy feelin' I must be dreamin'  
Your love has found it's way into my life  
You know your precious love has changed my life

",FALSE,FALSE
"201","Pat Benatar","We Live For Love","Your love's contagious, one kiss is dangerous  
But I have more to risk, than you to lose  
I feel passion growing  
I know that love is only just one inch away, from striking us  
We live for love  
We live for love  
  
When we get tired, and watch the summer fade away  
Will you think of romance, what will we do?  
Is there a place where we can go?  
Where time stands still for those who know?  
Till eternity we'll fulfill our desires  
  
We live for love  
We live for love  
We live for love  
We live for love  
  
I never planned to win the race  
But you convinced me face to face  
There was never a chance of losing at all  
  
We live for love  
We live for love  
We live for love  
We live for love  
  
We live for love  
We live for love  
We live for love...

",FALSE,FALSE
"202","Paul McCartney","Another Day","Every day she takes a morning bath she wets her hair,  
Wraps a towel around her  
As she's heading for the bedroom chair,  
Its just another day.  
Slipping into stockings,  
Stepping into shoes,  
Dipping in the pocket of her raincoat.  
Ah, it's just another day.  
  
At the office where the papers grow she takes a break,  
Drinks another coffee  
And she finds it hard to stay awake,  
  
Its just another day. du du du du du  
Its just another day. du du du du du  
Its just another day.  
  
Ay  
So sad, so sad,  
Sometimes she feels so sad.  
Alone in her apartment she'd dwell,  
Till the man of her dreams comes to break the spell.  
  
Ah, stay, don't stand around  
And he comes and he stays  
But he leaves the next day,  
So sad.  
Sometimes she feels so sad.  
  
As she posts another letter to the sound of five,  
People gather round her  
And she finds it hard to stay alive,  
  
Its just another day. du du du du du  
Its just another day. du du du du du  
Its just another day.  
  
Ay  
So sad, so sad,  
Sometimes she feels so sad.  
Alone in her apartment she'd dwell,  
Till the man of her dreams comes to break the spell.  
  
Ah, stay, don't stand around  
And he comes and he stays  
But he leaves the next day,  
So sad.  
Sometimes she feels so sad.  
  
Every day she takes a morning bath she wets her hair,  
Wraps a towel around her  
As she's heading for the bedroom chair,  
Its just another day.  
  
Slipping into stockings,  
Stepping into shoes,  
Dipping in the pockets of her raincoat.  
  
Ah, it's just another day. du du du du du  
Its just another day. du du du du du  
Its just another day.

",FALSE,FALSE
"203","Paul McCartney","I Am Your Singer","You are my love, you are my song, liger on,  
You are my song, I am your singer.  
You are my one, you are my own melody,  
You are my song, I am your singer.  
  
Someday when were singing  
We will fly away, going winging.  
  
Sing, singing my love song to you.  
  
My song is sung,  
When day is done harmonies willinger on,  
I am your singer,  
I am your singer,  
Singing my love song to you.

",FALSE,FALSE
"204","Paul Simon","That Was Your Mother","A long time ago, yeah  
Before you was born dude  
When I was still single  
And life was great  
  
I held this job as a traveling salesman  
That kept me moving from state to state  
Well, I'm standing on the corner of Lafayette  
State of Louisiana  
  
Wondering where a city boy could go  
To get a little conversation  
Drink a little red wine  
Catch a little bit of those Cajun girls  
Dancing to Zydeco  
  
Along come a young girl  
She's pretty as a prayerbook  
Sweet as an apple on Christmas day  
I said good gracious can this be my luck  
  
If that's my prayerbook  
Lord let us pray  
  
Well, I'm standing on the corner of Lafayette  
State of Louisiana  
Wondering what a city boy could do  
To get her in a conversation  
  
Drink a little red wine  
Dance to the music of Clifton Chenier  
The King of the Bayou  
  
Well, that was your mother  
And that was your father  
Before you was born dude  
When life was great  
  
You are the burden of my generation  
I sure do love you  
But let's get that straight  
  
Well, I'm standing on the corner of Lafayette  
Across the street from The Public  
Heading down to the Lone Star Cafe  
Maybe get a little conversation  
  
Drink a little red wine  
Standing in the shadow of Clifton Chenier  
Dancing the night away

",FALSE,FALSE
"205","Pearl Jam","Animal","One, two, three, four, five against one  
Five, five, five against one  
Said one, two, three, four, five against one  
Five, five, five, five, five against one  
  
Torture from you to me  
Abducted from the street  
  
I'd rather be,  
I'd rather be with,  
I'd rather be with an animal  
  
Why would you want to hurt me? Oh  
So frightened of your pain  
oh yeah, ooh  
  
I'd rather be,  
I'd rather be with,  
I'd rather be with an animal  
I'd rather be,  
I'd rather be  
I'd rather be with an animal  
  
I'd rather be,  
I'd rather be with,  
I'd rather be with an animal  
I'd rather be,  
I'd rather, rather be, oh  
rather be with an animal  
  
Said one, two, three, four, five against one  
Five, five, five, five, five against one  
One, two, three, four, five against one  
Five, five, five, five, five against one, said

",FALSE,FALSE
"206","Pet Shop Boys","All Over The World","(oh-way-oh, oh-way-oh  
Oh-way-oh, oh-way-oh  
Oh-way-oh, oh-way-oh  
Oh-way-oh, oh-way-oh)  
  
It's something  
That look in your eyes tonight  
Like magic  
It's changing everything in sight  
  
I hear it all around me every day  
In the music that you play  
  
[Repeat: x2]  
This is the sound  
Of all boys and girls  
You hear it  
Playing all over the world  
  
The night sky  
Like velvet masks our eyes tonight  
And falling  
Reveals the sunrise  
Ending night  
  
We feel it  
All around us  
Every day  
In the music that we play  
  
[Repeat: x3]  
This is the sound  
Of all boys and girls  
You hear it  
Playing all over the world  
  
(all over the world)  
Ey-ey-ey-ey  
[x4]  
  
Ay-oh-ay-oh  
  
It's sincere at its objective  
Superficial and true  
Easy and predictable  
Exciting and new  
Just say 'I want you'  
  
[Repeat: x2]  
This is the sound  
Of all boys and girls  
You hear it  
Playing all over the world

",FALSE,TRUE
"207","Pet Shop Boys","Always On My Mind","Maybe I didn't treat you  
Quite as good as I should  
Maybe I didn't love you  
Quite as often as I could  
Little things I should have said and done  
I never took the time  
  
You were always on my mind  
You were always on my mind  
  
Maybe I didn't hold you  
All those lonely, lonely times  
And I guess I never told you  
I am so happy that you're mine  
If I made you feel second best  
I'm so sorry I was blind  
  
You were always on my mind  
You were always on my mind  
  
Tell me, tell me that your sweet love hasn't died  
Give me,  
One more chance to keep you satisfied  
Satisfied  
  
Little things that I should have said and done  
I never took the time  
You were always on my mind  
You were always on my mind  
  
Tell me, tell me that your sweet love hasn't died  
Give me,  
One more chance to keep you satisfied  
You were always on my mind  
You were always on my mind  
You were always on my mind  
You were always on my mind  
You were always on my mind  
You were always on my mind  
  
Maybe I didn't treat you  
Quite as good as I should  
Maybe I didn't love you  
Quite as often as I could  
Maybe I didn't hold you  
All those lonely lonely times  
I guess I never told you  
I am so happy that you're mine

",FALSE,TRUE
"208","Pet Shop Boys","Beautiful People","City life just leaves me weak  
All this madness on the street  
Need to get away today  
Live my life a different way  
  
Is it only a fantasy  
To dream about a perfect me?  
  
[Chorus: x2]  
I want to live like beautiful people  
Give like beautiful people  
With like beautiful people around  
  
Buy the latest magazine  
And aspire to the dream  
Perfect home and perfect kids  
Not a life lived on the skids  
  
Is it only fantasy  
Or could it be reality?  
  
[Chorus: x2]  
  
Now I can see myself  
Without a care in the world  
It's a sun shining  
Money spending  
Green and healthy new world  
  
Is it only fantasy  
Or could it be reality?  
  
[Chorus: x2]

",FALSE,TRUE
"209","Pet Shop Boys","Being Boring","I came across a cache of old photos  
And invitations to teenage parties  
""Dress in white"" one said, with quotations  
From someone's wife, a famous writer  
In the nineteen-twenties  
When you're young you find inspiration  
In anyone who's ever gone  
And opened up a closing door  
She said: ""We were never feeling bored  
  
'Cause we were never being boring  
We had too much time to find for ourselves  
And we were never being boring  
We dressed up and fought, then thought: ""Make amends""  
And we were never holding back or worried that  
Time would come to an end""  
  
When I went I left from the station  
With a haversack and some trepidation  
Someone said: ""If you're not careful  
You'll have nothing left and nothing to care for  
In the nineteen-seventies""  
But I sat back and looking forward  
My shoes were high and I had scored  
I'd bolted through a closing door  
I would never find myself feeling bored  
  
'Cause we were never being boring  
We had too much time to find for ourselves  
And we were never being boring  
We dressed up and fought, then thought: ""Make amends""  
And we were never holding back or worried that  
Time would come to an end  
We were always hoping that, looking back  
You could always rely on a friend  
  
Now I sit with different faces  
In rented rooms and foreign places  
All the people I was kissing  
Some are here and some are missing  
In the nineteen-nineties  
I never dreamt that I would get to be  
The creature that I always meant to be  
But I thought in spite of dreams  
You'd be sitting somewhere here with me  
  
'Cause we were never being boring  
We had too much time to find for ourselves  
And we were never being boring  
We dressed up and fought, then thought: ""Make amends""  
And we were never holding back or worried that  
Time would come to an end  
We were always hoping that, looking back  
You could always rely on a friend  
  
And we were never being boring  
We had too much time to find for ourselves  
And we were never being boring  
We dressed up and fought, then thought: ""Make amends""  
And we were never being boring  
We were never being bored  
'Cause we were never being boring  
We were never being bored  

",FALSE,TRUE
"210","Pet Shop Boys","Building A Wall","[Repeat: x2]  
Protection (prevention)  
Detection (detention)  
There's no where to defect to any more  
  
[Repeat: x2]  
I'm building a wall  
A fine wall  
Not so much to keep you out  
More to keep me in  
  
Back then on a bomb site  
We were spies among the ruins  
Such precocious barbarians  
On TV we saw  
Cold War  
  
[Repeat: x2]  
Protection (prevention)  
Detection (detention)  
There's no where to defect to any more  
  
I'm leaving the world  
It's all wrong  
Not so much what many are doing  
Much more what's within us  
  
I'm building a wall  
A fine wall  
Not so much to keep you out  
More to keep me in  
  
Jesus and the man from Angol  
Caesar conquered Gaul  
Scouting for Centurians  
On a Roman war  
  
Through the woods, the trees  
And further on, the sea  
We lived in the shadow of the wall  
Sand in the sandwiches  
Wasps in the tea  
It was a free country  
(who do you think you are, Captain Britain?)  
  
I'm building a wall  
A fine wall  
Not so much to keep you out  
More to keep me in  
  
I'm losing my head  
Well, why not?  
More work for the undertaker  
Means there's less for me  
  
[Repeat: x3]  
I'm building a wall  
A fine wall  
Not so much to keep you out  
More to keep me in

",FALSE,TRUE
"211","Pet Shop Boys","Casanova In Hell","The girl's perfection  
Inspires affection  
It's queer that here  
He can't cast his spell  
In her direction  
Somewhere near  
One senses fear  
Casanova in Hell  
  
The girl is naked  
The boy is naked  
He hides inside  
A secret chamber, there to gape  
Through a velvet drape  
And dream of rape  
Casanova in Hell  
  
Her sharp suggestion  
He couldn't get an erection  
Came as a shock  
He finds himself  
A laughing stock  
His ageing fate  
To contemplate  
Casanova in Hell  
  
Back in the library  
His revenge is his story  
What he will write  
Will recall the bite  
Of his wit and legendary appetite  
The sybarite  
Casanova is well  
  
For Casanova has the last laugh  
Creates the myth and vindication  
Of his sexual vocation  
Makes the definitive collection  
His lives and lovers and above all  
His erection  
Will live in history

",FALSE,TRUE
"212","Pet Shop Boys","Did You See Me Coming?","Did you see me coming?  
Was I that obvious?  
For all of a sudden  
There were just two of us  
  
You don't have be in ""Who's Who"" to know what's what  
You don't have to be a high-flyer to catch your slot  
The night we met was cold and wet  
I needed a drink or two  
I saw you standing there and I knew  
I'd love to be loved by you  
  
Did you see me coming?  
Was I that obvious?  
For all of a sudden  
There were just two of us  
  
You don't have to be what's what to know who's who  
You don't need the DNA to find the proof  
Then and there my life made sense  
You were the evidence  
  
Did you see me coming?  
Was I that obvious?  
For all of a sudden  
There were just two of us  
Did you see me coming?  
I thought I'd have to make  
All of the running  
I was all yours to take  
  
Am I superstitious or really religious  
Just ""to thyself be true""  
But now I think I'm starting to believe in fate  
Because it delivered you  
  
Did you see me coming?  
Was I that obvious?  
For all of a sudden  
There were just two of us  
Did you see me coming?  
I thought I'd have to make  
All of the running  
I was all yours to take

",FALSE,TRUE
"213","Pet Shop Boys","Domino Dancing","I don't know why, I don't know how,  
I thought I loved you but, I'm not sure now,  
I've seen you look at strangers,  
Too many times,  
The love you want, is of a different kind  
  
All day, all day, Watch them all fall down,  
All day, all day, Domino dancing,  
  
Remember when we felt the sun,  
A love like paradise,  
How hot it burned,  
A threat of distant thunder,  
The sky was red,  
And where you walked you always,  
Turned ev'ry head  
  
All day, all day, Watch them all fall down,  
All day, all day, Domino dancing,  
  
I thought that when we fought  
I was to blame,  
But now I know you play,  
A different game,  
I've seen you dance with danger,  
Still wanting more,  
Add another number, To the score  
  
All day, all day, Watch them all fall down,  
All day, all day, Domino dancing,  
When you look around you wonder  
Do you play to win or are you just a bad loser?  
All day, all day, All day, all day,  
  
I don't know why, I don't know how,  
I thought I loved you but, I'm not sure now,  
I hear the thunder crashing, The sky is dark,  
And now a storm is breaking, Within my heart.  
  
All day, all day, Watch them all fall down,  
All day, all day, Domino dancing,  
All day, all day, Watch them all fall down,  
All day, all day, Domino dancing,  
All day, all day, Watch them all fall down,

",FALSE,TRUE
